tiktok_handle,display_name,party_name,storkreds,account_type,video_id,upload_dato,beskrivelse,visninger,likes,kommentarer,shares,gemmer,video_url
havndrup,Isabel Havndrup Aackmann,Radikale Venstre,Københavns Omegns Storkreds,kandidat,7619967933933980950,2026-03-22,"“DaNmARks uDLeDnInGER beTYDeR InGEnTInG i dET sTOrE HeLE” Hold nu op. Show them don’t tell them og tag lidt ansvar. Stem grønt, allerhelst radikalt. Vi kan godt. #dkpol #politik #dansktiktok #politiktok #klima ",2185,47,1,0,2,https://www.tiktok.com/@havndrup/video/7619967933933980950
havndrup,Isabel Havndrup Aackmann,Radikale Venstre,Københavns Omegns Storkreds,kandidat,7619657100121148694,2026-03-21,"Det er ikke altid det nemme valg, som er det rigtige valg. Stem Liste 🅱️ på tirsdag. Der er brug for en Plan B🩷💚#dkpol #politik #dansktiktok #politiktok ",10000,206,3,3,15,https://www.tiktok.com/@havndrup/video/7619657100121148694
havndrup,Isabel Havndrup Aackmann,Radikale Venstre,Københavns Omegns Storkreds,kandidat,7619318743532981526,2026-03-20,Den her dag har for meget kosmisk energi. Jeg kan ikke #dkpol #politik #studytok #dansktiktok ,1910,42,1,0,2,https://www.tiktok.com/@havndrup/video/7619318743532981526
havndrup,Isabel Havndrup Aackmann,Radikale Venstre,Københavns Omegns Storkreds,kandidat,7618828231705103638,2026-03-19,"Så hvordan løser vi klimakrisen? Vi trækker i arbejdstøjet og gør det, vi ved virker og rydder op efter os selv. Et grønt landbrug og grønt strøm i stikkontakterne🥕🔋#dkpol #politik #politiktok #dansktiktok ",332,23,0,0,2,https://www.tiktok.com/@havndrup/video/7618828231705103638
havndrup,Isabel Havndrup Aackmann,Radikale Venstre,Københavns Omegns Storkreds,kandidat,7618097938887101718,2026-03-17,"Nok det sidste valg inden 2030 målet. Der er forskel på hvad politikerne vil på klima. Gå ned og stem på en (mig) som reelt vil gøre benarbejdet for, at vi når i mål med Klimaloven🌍🌱#dkpol #politik #politiktok #dansktiktok ",1194,53,3,1,3,https://www.tiktok.com/@havndrup/video/7618097938887101718
havndrup,Isabel Havndrup Aackmann,Radikale Venstre,Københavns Omegns Storkreds,kandidat,7617099420823489794,2026-03-14,"Det burde ikke være sådan her. Klimapolitik er sikkerhedspolitik og sikkerhedspolitik er klimapolitik. Lad os blive fri af fossil energi fra ustabile regioner, og selvforsynende af grøn energi🛢️🪫🔋 #dkpol #politik #politiktok #dansktiktok ",1509,39,2,0,4,https://www.tiktok.com/@havndrup/video/7617099420823489794
havndrup,Isabel Havndrup Aackmann,Radikale Venstre,Københavns Omegns Storkreds,kandidat,7616622187394682115,2026-03-13,"Det eneste vand, jeg vil have på flaske er danskvand🫧  (obs ikke at nitrat er det samme som parasitter, men levemåden bliver den samme) #dkpol #politik #politiktok #dansktiktok  ",1970,96,2,0,5,https://www.tiktok.com/@havndrup/video/7616622187394682115
havndrup,Isabel Havndrup Aackmann,Radikale Venstre,Københavns Omegns Storkreds,kandidat,7615869526525136131,2026-03-11,"Er der nogen derude, som kan hjælpe?🚜🚜🚜 #dkpol #politik #politiktok #dansktiktok ",12600,383,25,11,15,https://www.tiktok.com/@havndrup/video/7615869526525136131
havndrup,Isabel Havndrup Aackmann,Radikale Venstre,Københavns Omegns Storkreds,kandidat,7614954323109350678,2026-03-08,Glædelig Kampdag (og ekstra meget til jer som er blødt igennem i dag)🫰🏼 #dkpol #politik #politiktok #dansktiktok ,14800,1780,21,139,88,https://www.tiktok.com/@havndrup/video/7614954323109350678
havndrup,Isabel Havndrup Aackmann,Radikale Venstre,Københavns Omegns Storkreds,kandidat,7614576486221171990,2026-03-07,"Det er okay at være træt. Det er okay, hvis du ikke orker i morgen. Hver dag er kampdag, så tag kampen, når du har energien #dkpol #politik #politiktok #dansktiktok #feminisme ",1300,52,0,3,4,https://www.tiktok.com/@havndrup/video/7614576486221171990
havndrup,Isabel Havndrup Aackmann,Radikale Venstre,Københavns Omegns Storkreds,kandidat,7613489459799035158,2026-03-04,"Der er breeeeev💌 eller i hvert fald åbent for brevstemmer. Så her en lille guide fra en ordblind til en anden. Stem på mig hvis du bor i Gentofte, Lyngby-Taarbæk, Gladsaxe, Herlev, Ballerup, Brøndby, Hvidovre, Rødorve, Ishøj, Vallensbæk, Glostrup, Al",1229,42,2,0,2,https://www.tiktok.com/@havndrup/video/7613489459799035158
havndrup,Isabel Havndrup Aackmann,Radikale Venstre,Københavns Omegns Storkreds,kandidat,7613030825201847574,2026-03-03,"Igen og igen, men denne gang med en rigtig god afledningsmanøvre fra Statsministeren. Danmark er IKKE på vej mod 70% målet i 2030, but who cares? Der er vaaaaalg✨🌱 #dkpol #politiktok #dansktiktok #politik #klima ",485,32,1,0,1,https://www.tiktok.com/@havndrup/video/7613030825201847574
havndrup,Isabel Havndrup Aackmann,Radikale Venstre,Københavns Omegns Storkreds,kandidat,7612712902058904854,2026-03-02,"Jeg kan bedre lide buzzfeed quizzes, men Messeren får blodet til at koge i kroppen på mig🤭 #dkpol #politiktok #dansktiktok #politik #greenscreen ",15700,1987,34,143,142,https://www.tiktok.com/@havndrup/video/7612712902058904854
havndrup,Isabel Havndrup Aackmann,Radikale Venstre,Københavns Omegns Storkreds,kandidat,7612194615092956438,2026-03-01,"TV2 er så thirsty efter ft-kandidaters civiltilstand, at jeg nu hard launcher mit nye forhold i deres kandidattest🤙🏼 #dkpol #politiktok #dansktiktok #politik ",9069,125,3,5,7,https://www.tiktok.com/@havndrup/video/7612194615092956438
havndrup,Isabel Havndrup Aackmann,Radikale Venstre,Københavns Omegns Storkreds,kandidat,7611931269936467203,2026-02-28,"Svarer @JRBDescende den danske regering har stor indflydelse på EU og Dannark skal vise verden at det gode, bæredygtige liv er muligt #dkpol #politiktok #dansktiktok #politik #klima ",1542,85,8,0,7,https://www.tiktok.com/@havndrup/video/7611931269936467203
havndrup,Isabel Havndrup Aackmann,Radikale Venstre,Københavns Omegns Storkreds,kandidat,7611410003978702102,2026-02-27,"Det er en ommer, Kåre Quist. Det kan godt være mener, vi får massere tid i løbet af valgkampen til at diskutere det, men det er nu danskerne er locked-in også forspilder I chancen? #dkpol #politiktok #dansktiktok #politik ",19700,1042,116,24,45,https://www.tiktok.com/@havndrup/video/7611410003978702102
havndrup,Isabel Havndrup Aackmann,Radikale Venstre,Københavns Omegns Storkreds,kandidat,7610859557547511062,2026-02-25,You have free will. Remember that. And perhaps apply for an internship at an embassy abroad #travel #backpacking #freewill ,9730,914,44,3,24,https://www.tiktok.com/@havndrup/video/7610859557547511062
havndrup,Isabel Havndrup Aackmann,Radikale Venstre,Københavns Omegns Storkreds,kandidat,7591503868257717526,2026-01-04,"I 2025 deltog jeg i DM i Debat, løb mit første halvmarthon, rejste en måned med en af mine bedste og ældste veninder, lærte at surfe, stillede op til mit første valg, blev valgt til det valg, mennesker jeg holder utrolig meget af blev forlovet og and",345,12,0,1,1,https://www.tiktok.com/@havndrup/video/7591503868257717526
havndrup,Isabel Havndrup Aackmann,Radikale Venstre,Københavns Omegns Storkreds,kandidat,7588868571711687958,2025-12-28,"Afbryder lige julefreden med et surt opstød til højrefløjen, når nu Troels Lund Poulsen og Alex Vanopslagh har fraskrevet sig deres sidste liberale principper #dkpol #dkpolitik #politiktok ",2486,172,27,1,9,https://www.tiktok.com/@havndrup/video/7588868571711687958
havndrup,Isabel Havndrup Aackmann,Radikale Venstre,Københavns Omegns Storkreds,kandidat,7574796722493230358,2025-11-20,587 gange tak. Jeg er valgt til kommunalbestyrelsen på Frederiksberg med 587 personlige stemmer. Det føles virkelig stort #kv25 #politik #dkpol ,5462,177,8,5,3,https://www.tiktok.com/@havndrup/video/7574796722493230358
havndrup,Isabel Havndrup Aackmann,Radikale Venstre,Københavns Omegns Storkreds,kandidat,7573727772640660758,2025-11-17,"Og lige meget hvad du stemmer, så ungt. Unge er stærkt underrepræsenteret og vores stemmer skal høres🫰🏼 #dkpol #politik #kv25 #feminisme #demokrati ",13000,171,12,3,7,https://www.tiktok.com/@havndrup/video/7573727772640660758
havndrup,Isabel Havndrup Aackmann,Radikale Venstre,Københavns Omegns Storkreds,kandidat,7573612762266357014,2025-11-17,"Nu er det åbenbart ikke kun DF, men også Mette F, der synes fremmedfjensk efterspørgselsregulering er løsningen på boligkrisen. Jeg siger nej tak. #dkpol #politik #kv25 #foreignerindenmark #subwaytakes ",6406,92,3,11,9,https://www.tiktok.com/@havndrup/video/7573612762266357014
havndrup,Isabel Havndrup Aackmann,Radikale Venstre,Københavns Omegns Storkreds,kandidat,7573352976647982358,2025-11-16,"Svarer @Irina Frost, SF Der er altid et udbud og altid en efterspørgsel. Vi kan godt diskutere om der er fri konkurrence, for det københavnske/frederiksbergske boligmarked ligner nok mere et oligopol #dkpol #politik #kv25 #økonomi ",829,25,1,0,1,https://www.tiktok.com/@havndrup/video/7573352976647982358
havndrup,Isabel Havndrup Aackmann,Radikale Venstre,Københavns Omegns Storkreds,kandidat,7573225000388365590,2025-11-16,"Både @Freja Fokdal og jeg stiller op til kommunalvalget på Frederiksberg for Radikale Venstre. Er der plads til to unge kvinder under 30 med brunt hår i det samme parti? Øh, ja. #politik #dkpol #kv25 #girlsgirl Long read: Freja er det sejeste mennesk",4210,116,4,1,4,https://www.tiktok.com/@havndrup/video/7573225000388365590
havndrup,Isabel Havndrup Aackmann,Radikale Venstre,Københavns Omegns Storkreds,kandidat,7572613161094876438,2025-11-14,Lidt om mit forhold til valgplakater som en ægte klimapige🌍🌱🩷 #politik #dkpol #kv25 #klima #bæredygtighed ,1450,45,6,0,7,https://www.tiktok.com/@havndrup/video/7572613161094876438
havndrup,Isabel Havndrup Aackmann,Radikale Venstre,Københavns Omegns Storkreds,kandidat,7572263999539121430,2025-11-13,"MENSTRUATIONSPRODUKTER PÅ ALLE FOLKESKOLETOILETTER NU En stor del af grunden til, at jeg valgte at stille op til kommunalvalget på Frederiksberg, var fordi, jeg ville have menstruationsprodukter på vores folkeskoletoiletter. Hver 10. menstruerende el",86900,4935,150,149,207,https://www.tiktok.com/@havndrup/video/7572263999539121430
havndrup,Isabel Havndrup Aackmann,Radikale Venstre,Københavns Omegns Storkreds,kandidat,7572078604469767446,2025-11-13,"MERE CYKELPARKERING PÅ FREDERIKSBERG🚲  Jeg har været en tur forbi CBS, hvor de studerende heldigvis tager cyklen. Det skal kommunen støtte op om, ved at sætte noget mere cykelparkering på pladsen foran CBS og mange andre steder i byen. Og se min pink",9464,69,12,3,3,https://www.tiktok.com/@havndrup/video/7572078604469767446
havndrup,Isabel Havndrup Aackmann,Radikale Venstre,Københavns Omegns Storkreds,kandidat,7571026830111591702,2025-11-10,"Send meget gerne den her video til en ven på Frederiksberg🫶🏻 Det er nemlig lidt svært at ramme en frederiksbergborger, når vi bevæger os så meget rundt i omegnskommunen (København). Men alle kender én, som bor på Frederiksberg🤞🏼 JEG HEDDER ISABEL OG ",649,26,6,4,2,https://www.tiktok.com/@havndrup/video/7571026830111591702
havndrup,Isabel Havndrup Aackmann,Radikale Venstre,Københavns Omegns Storkreds,kandidat,7570688905683438870,2025-11-09,Stem Jakob Skyggebjerg til kommunalvalget i København. He is a pal.  For klimaet og flere boliger til unge. #dkpol #politik #kbh #hamilton  @Jakob Skyggebjerg ,591,25,0,2,1,https://www.tiktok.com/@havndrup/video/7570688905683438870
havndrup,Isabel Havndrup Aackmann,Radikale Venstre,Københavns Omegns Storkreds,kandidat,7569985675475438870,2025-11-07,#Sammenføj med @Frej Kofoed ,469,10,0,3,2,https://www.tiktok.com/@havndrup/video/7569985675475438870
havndrup,Isabel Havndrup Aackmann,Radikale Venstre,Københavns Omegns Storkreds,kandidat,7569625279711235350,2025-11-06,"Må man overhovedet cykle på Frederiksberg Alle? Det føles i hvert fald ikke sådan. Det er på tide, vi prioriterer cyklerne på frb🚲💚 #dkpol #politik #cykel #klima ",32400,346,32,8,8,https://www.tiktok.com/@havndrup/video/7569625279711235350
havndrup,Isabel Havndrup Aackmann,Radikale Venstre,Københavns Omegns Storkreds,kandidat,7568041133289344258,2025-11-02,Vi starter i de små #dkpol #politik #feminisme #kvindesundhed ,6975,164,10,0,8,https://www.tiktok.com/@havndrup/video/7568041133289344258
havndrup,Isabel Havndrup Aackmann,Radikale Venstre,Københavns Omegns Storkreds,kandidat,7567120478893133078,2025-10-30,Cool girls gatekeeper ikke de gode læger. Anbefal de gode til dine veninder #dkpol #politik #kvindesundhed #feminisme ,14200,135,5,13,11,https://www.tiktok.com/@havndrup/video/7567120478893133078
havndrup,Isabel Havndrup Aackmann,Radikale Venstre,Københavns Omegns Storkreds,kandidat,7566309853681978646,2025-10-28,"Ærligt, hvad taler normale mennesker om, når de ikke taler om politik eller taylor? #dkpol #politik #taylorswift",2052,71,1,2,5,https://www.tiktok.com/@havndrup/video/7566309853681978646
havndrup,Isabel Havndrup Aackmann,Radikale Venstre,Københavns Omegns Storkreds,kandidat,7565533215906221334,2025-10-26,Hvordan kommer sådan nogle plakater egentlig op i luften? Ikke uden de bedste mennesker🫶🏻 #dkpol #politik #venner #adayinmylife,2814,77,4,0,7,https://www.tiktok.com/@havndrup/video/7565533215906221334
havndrup,Isabel Havndrup Aackmann,Radikale Venstre,Københavns Omegns Storkreds,kandidat,7564323642692128022,2025-10-23,"En plantepige, der ikke har mere plads må tænke kreativt🌱🌳🐝 #dkpol #politik #planter #natur ",321,26,1,1,2,https://www.tiktok.com/@havndrup/video/7564323642692128022
havndrup,Isabel Havndrup Aackmann,Radikale Venstre,Københavns Omegns Storkreds,kandidat,7562985504690670871,2025-10-19,Det burde ikke være så svært ffs #dkpol #politik #endometriose #feminisme ,4325,177,10,7,9,https://www.tiktok.com/@havndrup/video/7562985504690670871
havndrup,Isabel Havndrup Aackmann,Radikale Venstre,Københavns Omegns Storkreds,kandidat,7562158237089271062,2025-10-17,Jeg har fået flyers!! #dkpol #politik #politiktok #dansktiktok #unboxing,556,17,0,0,1,https://www.tiktok.com/@havndrup/video/7562158237089271062
havndrup,Isabel Havndrup Aackmann,Radikale Venstre,Københavns Omegns Storkreds,kandidat,7561748675412659478,2025-10-16,"@emil_samaras pas på med de retoriske spørgsmål. Det kan være, at nogen er nok på spektrummet til at svare🥰 #økonomi #politik #dkpol ",9282,149,52,6,30,https://www.tiktok.com/@havndrup/video/7561748675412659478
havndrup,Isabel Havndrup Aackmann,Radikale Venstre,Københavns Omegns Storkreds,kandidat,7561441434105138454,2025-10-15,"“Hvis mænd ikke skulle skide, havde kvinder rendt rundt med toiletpapir i tasken” #feminisme #dkpol #politik ",36200,1920,148,34,92,https://www.tiktok.com/@havndrup/video/7561441434105138454
havndrup,Isabel Havndrup Aackmann,Radikale Venstre,Københavns Omegns Storkreds,kandidat,7561109225104117015,2025-10-14,1800-tallet har ringet og vil have sine spørgsmål igen #politik #dkpol #feminisme ,13000,130,47,8,7,https://www.tiktok.com/@havndrup/video/7561109225104117015
havndrup,Isabel Havndrup Aackmann,Radikale Venstre,Københavns Omegns Storkreds,kandidat,7560299771819347222,2025-10-12,Can we get back to politics? The world is boiling and at war. Hope our politicians use most of their time on better things. Also love me a veggie burger #hamilton #musicaltheater #vegetarian #politics  ,42800,5096,0,203,95,https://www.tiktok.com/@havndrup/video/7560299771819347222
havndrup,Isabel Havndrup Aackmann,Radikale Venstre,Københavns Omegns Storkreds,kandidat,7559132397510528279,2025-10-09,"Så tror jeg godt jeg ved, hvem du skal stemme på til kommunalvalget 😝 #fyp #taylorswift #ts12 #dkpol #politiktok ",4478,91,0,0,2,https://www.tiktok.com/@havndrup/video/7559132397510528279
havndrup,Isabel Havndrup Aackmann,Radikale Venstre,Københavns Omegns Storkreds,kandidat,7553941355395960086,2025-09-25,Find link i bio hos bedste @Maria Georgi Sloth  #kvinder #ligestilling #sundhed #dansktiktok #dkpol ,1898,79,7,5,7,https://www.tiktok.com/@havndrup/video/7553941355395960086
