tiktok_handle,display_name,party_name,storkreds,account_type,video_id,upload_dato,beskrivelse,visninger,likes,kommentarer,shares,gemmer,video_url
madsolsensf,Mads Olsen,SF - Socialistisk Folkeparti,Sjællands Storkreds,kandidat,7620011684882681110,2026-03-22,"Det skal koste 29 kr at tage fra Roskilde til København, ikke 58!",7469,189,7,8,7,https://www.tiktok.com/@madsolsensf/video/7620011684882681110
madsolsensf,Mads Olsen,SF - Socialistisk Folkeparti,Sjællands Storkreds,kandidat,7619714767531429142,2026-03-21,Lad os gøre offentlig transport billigere fremfor dyrere!,464,17,1,1,0,https://www.tiktok.com/@madsolsensf/video/7619714767531429142
madsolsensf,Mads Olsen,SF - Socialistisk Folkeparti,Sjællands Storkreds,kandidat,7618948130788150550,2026-03-19,"Nok er nok, jeg går drikkevandsamok!",3442,194,11,9,3,https://www.tiktok.com/@madsolsensf/video/7618948130788150550
madsolsensf,Mads Olsen,SF - Socialistisk Folkeparti,Sjællands Storkreds,kandidat,7618649815810952470,2026-03-18,"Jeg vælger at bruge pengene på SF’s folkeskoleudspil, hvad vælger du?",2366,144,17,6,3,https://www.tiktok.com/@madsolsensf/video/7618649815810952470
madsolsensf,Mads Olsen,SF - Socialistisk Folkeparti,Sjællands Storkreds,kandidat,7618227712548818198,2026-03-17,Tak til den politiske ekspert for plakatideen🫶,1611,122,2,23,7,https://www.tiktok.com/@madsolsensf/video/7618227712548818198
madsolsensf,Mads Olsen,SF - Socialistisk Folkeparti,Sjællands Storkreds,kandidat,7617842252211113238,2026-03-16,Lad Bardia blive 🙏🙏,68700,4483,72,336,257,https://www.tiktok.com/@madsolsensf/video/7617842252211113238
madsolsensf,Mads Olsen,SF - Socialistisk Folkeparti,Sjællands Storkreds,kandidat,7617530192017313046,2026-03-15,Husk det 24 marts❤️💚,17700,817,10,211,21,https://www.tiktok.com/@madsolsensf/video/7617530192017313046
madsolsensf,Mads Olsen,SF - Socialistisk Folkeparti,Sjællands Storkreds,kandidat,7617177554792795414,2026-03-14,"I stedet for at købe 500 ekstra valgplakater, har vi valgt at invitere over 100 børn i biffen under valget og give dem en fed oplevelse❤️ Det var hyggeligt, og jeg fik også nogle flotte tegnede valgplakater som jeg har lovet skal hænge på mit kontor,",2817,146,1,5,5,https://www.tiktok.com/@madsolsensf/video/7617177554792795414
madsolsensf,Mads Olsen,SF - Socialistisk Folkeparti,Sjællands Storkreds,kandidat,7616760138589867286,2026-03-13,"Det er dyrt at være ung, husk kondom og lad os gøre noget ved de høje priser og SU’en!",2070,109,5,10,2,https://www.tiktok.com/@madsolsensf/video/7616760138589867286
madsolsensf,Mads Olsen,SF - Socialistisk Folkeparti,Sjællands Storkreds,kandidat,7616060293013081366,2026-03-11,"På tide man også kan få boligstøtte, hvis man bor på kollegie uden eget køkken!",2337,134,10,1,3,https://www.tiktok.com/@madsolsensf/video/7616060293013081366
madsolsensf,Mads Olsen,SF - Socialistisk Folkeparti,Sjællands Storkreds,kandidat,7615707435541482774,2026-03-10,Lad os nu få det ekstra SU år tilbage!#socialist ,15900,709,42,31,26,https://www.tiktok.com/@madsolsensf/video/7615707435541482774
madsolsensf,Mads Olsen,SF - Socialistisk Folkeparti,Sjællands Storkreds,kandidat,7613436712697498902,2026-03-04,"Helt seriøst, kan den rigeste elite stoppe med at brokke sig? #socialist ",2952,202,54,1,7,https://www.tiktok.com/@madsolsensf/video/7613436712697498902
madsolsensf,Mads Olsen,SF - Socialistisk Folkeparti,Sjællands Storkreds,kandidat,7613062208922209558,2026-03-03,Kræver hård træning at dele så mange flyers ud ,4690,209,7,3,7,https://www.tiktok.com/@madsolsensf/video/7613062208922209558
madsolsensf,Mads Olsen,SF - Socialistisk Folkeparti,Sjællands Storkreds,kandidat,7612945288659029270,2026-03-03,Kunne være super fedt med drikkevandet til fremtiden også 🫶 #environmental ,1720,126,7,1,3,https://www.tiktok.com/@madsolsensf/video/7612945288659029270
madsolsensf,Mads Olsen,SF - Socialistisk Folkeparti,Sjællands Storkreds,kandidat,7612219585076530454,2026-03-01,Lad os give unge ro på! #socialism #dkpolitik ,3643,292,8,17,12,https://www.tiktok.com/@madsolsensf/video/7612219585076530454
madsolsensf,Mads Olsen,SF - Socialistisk Folkeparti,Sjællands Storkreds,kandidat,7611818237646392598,2026-02-28,Bedre og billigere offentlig transport nu! #transport #trains ,6470,270,23,2,3,https://www.tiktok.com/@madsolsensf/video/7611818237646392598
madsolsensf,Mads Olsen,SF - Socialistisk Folkeparti,Sjællands Storkreds,kandidat,7611593875899059478,2026-02-27,Nogen skal jo gøre det🤷💪 #socialism #green #inequality ,2782,151,16,3,6,https://www.tiktok.com/@madsolsensf/video/7611593875899059478
madsolsensf,Mads Olsen,SF - Socialistisk Folkeparti,Sjællands Storkreds,kandidat,7610865231048264982,2026-02-25,Drop nu bare skæve skattelettelser i stedet for u lands bistanden!#socialism #green ,1593,84,11,3,2,https://www.tiktok.com/@madsolsensf/video/7610865231048264982
madsolsensf,Mads Olsen,SF - Socialistisk Folkeparti,Sjællands Storkreds,kandidat,7608947124088081686,2026-02-20,Når regeringen ikke vil kæmpe for unge skal jeg nok gøre det!#socialism #green #inequality ,19500,1519,19,28,34,https://www.tiktok.com/@madsolsensf/video/7608947124088081686
madsolsensf,Mads Olsen,SF - Socialistisk Folkeparti,Sjællands Storkreds,kandidat,7608598780421754134,2026-02-19,Kort lidt House tour😎 ,8034,280,10,4,10,https://www.tiktok.com/@madsolsensf/video/7608598780421754134
madsolsensf,Mads Olsen,SF - Socialistisk Folkeparti,Sjællands Storkreds,kandidat,7607083432233012502,2026-02-15,"Kom nu Venstre, vi skal altså også have rent drikkevand i fremtiden!#green ",1643,87,0,6,4,https://www.tiktok.com/@madsolsensf/video/7607083432233012502
madsolsensf,Mads Olsen,SF - Socialistisk Folkeparti,Sjællands Storkreds,kandidat,7603746289091611926,2026-02-06,"Nej tak til sprøjtegift over drikkevandet og grundvandet, ja tak til rent vand i vandhanen☺️💧#water #environmental ",1332,72,12,7,1,https://www.tiktok.com/@madsolsensf/video/7603746289091611926
madsolsensf,Mads Olsen,SF - Socialistisk Folkeparti,Sjællands Storkreds,kandidat,7603025639804816662,2026-02-04,"Lad os gøre offentlig transport gratis for de børn og unge, der vokser op i fattigdom! #socialism #transport #climatechange ",1318,63,8,1,2,https://www.tiktok.com/@madsolsensf/video/7603025639804816662
madsolsensf,Mads Olsen,SF - Socialistisk Folkeparti,Sjællands Storkreds,kandidat,7600792428769021206,2026-01-29,Hvad vælger du? Gratis offentlig transport til 75.000 børn eller hjælp til folk med forældrekøbte lejligheder?🤔,12800,611,12,16,17,https://www.tiktok.com/@madsolsensf/video/7600792428769021206
madsolsensf,Mads Olsen,SF - Socialistisk Folkeparti,Sjællands Storkreds,kandidat,7600089287903677718,2026-01-27,Nogen skal jo kæmpe for de studerende💪,1892,50,14,3,0,https://www.tiktok.com/@madsolsensf/video/7600089287903677718
madsolsensf,Mads Olsen,SF - Socialistisk Folkeparti,Sjællands Storkreds,kandidat,7599715934445538582,2026-01-26,"Nu sætter vi hårdt ind imod Airbnb snyd, det er på tide at tage vores byer tilbage!#socialism ",1457,80,10,1,0,https://www.tiktok.com/@madsolsensf/video/7599715934445538582
madsolsensf,Mads Olsen,SF - Socialistisk Folkeparti,Sjællands Storkreds,kandidat,7598210236473740566,2026-01-22,Husk nu også de studerende🙏,2685,110,22,0,5,https://www.tiktok.com/@madsolsensf/video/7598210236473740566
madsolsensf,Mads Olsen,SF - Socialistisk Folkeparti,Sjællands Storkreds,kandidat,7597469704072006934,2026-01-20,"Offentlig transport skal være billigere, ikke dyrere! Det er da helt vildt når vi lever i en klimakrise😬 #transport #climatechange ",1328,85,10,1,5,https://www.tiktok.com/@madsolsensf/video/7597469704072006934
madsolsensf,Mads Olsen,SF - Socialistisk Folkeparti,Sjællands Storkreds,kandidat,7593423978794962198,2026-01-09,"I maj 2026 kan du ikke længere bruge rejsekortet, men du kan til gengæld bruge basiskortet i stedet! Synes du DSB osv har været gode nok til at fortælle det?#danmark🇩🇰 #transport ",36300,2009,47,100,214,https://www.tiktok.com/@madsolsensf/video/7593423978794962198
madsolsensf,Mads Olsen,SF - Socialistisk Folkeparti,Sjællands Storkreds,kandidat,7589263832741088534,2025-12-29,Så længe de riges tillidsmand i form af Venstre er i regering kommer der ikke en afgift på privatfly. Desværre. Krydser fingre for en rød regering næste år🤞 #taxtherich #climatechange #socialism ,1145,70,4,3,2,https://www.tiktok.com/@madsolsensf/video/7589263832741088534
