tiktok_handle,display_name,party_name,storkreds,account_type,video_id,upload_dato,beskrivelse,visninger,likes,kommentarer,shares,gemmer,video_url
malte.larsen0,Malte Larsen,Socialdemokratiet,Østjyllands Storkreds,kandidat,7615697296566652182,2026-03-10,"Indvandrerdrenge river ulovligt mine valgplakater i Hundige ned, og viser dem frem i bybilledet. De må være vilde med mig og Dansk Folkeparti :)",125400,5894,124,1343,403,https://www.tiktok.com/@malte.larsen0/video/7615697296566652182
malte.larsen0,Malte Larsen,Socialdemokratiet,Østjyllands Storkreds,kandidat,7591164182305705238,2026-01-03,"Lad os vise vores støtte til garderen. Han passede bare sit arbejde, og han gjorde det helt rigtige.",166000,9183,266,200,416,https://www.tiktok.com/@malte.larsen0/video/7591164182305705238
malte.larsen0,Malte Larsen,Socialdemokratiet,Østjyllands Storkreds,kandidat,7620046125046844694,2026-03-22,"Samira Nawas jagt efter muslimske stemmer, part 2.",1064,125,5,8,8,https://www.tiktok.com/@malte.larsen0/video/7620046125046844694
malte.larsen0,Malte Larsen,Socialdemokratiet,Østjyllands Storkreds,kandidat,7619406324106874134,2026-03-20,Meget taknemmelig for Mikkel Bjørns varme anbefaling!,2091,180,4,9,11,https://www.tiktok.com/@malte.larsen0/video/7619406324106874134
malte.larsen0,Malte Larsen,Socialdemokratiet,Østjyllands Storkreds,kandidat,7619278473244314902,2026-03-20,"Nuur Mohamed, rejs nu hjem, hvis du ikke bryder dig om forholdene på Kærshovedgård. Du burde overhovedet ikke være i Danmark.",4343,209,8,17,16,https://www.tiktok.com/@malte.larsen0/video/7619278473244314902
malte.larsen0,Malte Larsen,Socialdemokratiet,Østjyllands Storkreds,kandidat,7619225633582845206,2026-03-20,Ayatollaherne skal kyles ud af Danmark!,1688,127,1,6,6,https://www.tiktok.com/@malte.larsen0/video/7619225633582845206
malte.larsen0,Malte Larsen,Socialdemokratiet,Østjyllands Storkreds,kandidat,7618677578768928022,2026-03-18,"Hvem er jeg, og hvorfor stiller jeg op til Folketinget? Det svarer jeg på her - håber du vil lytte med!",29400,925,20,102,65,https://www.tiktok.com/@malte.larsen0/video/7618677578768928022
malte.larsen0,Malte Larsen,Socialdemokratiet,Østjyllands Storkreds,kandidat,7618253674510355734,2026-03-17,"“Dø i helvede”, “fuck dig, din racist”  Råbte en flok indvandrere til mig, da jeg stilfærdigt tilbød dem en af mine flyers. Hvis de oprigtigt undrer sig over, hvorfor vi i Dansk Folkeparti er kritiske overfor indvandrere fra Mellemøsten, burde de ærl",3719,276,13,37,21,https://www.tiktok.com/@malte.larsen0/video/7618253674510355734
malte.larsen0,Malte Larsen,Socialdemokratiet,Østjyllands Storkreds,kandidat,7618222595892071702,2026-03-17,Terrorister skal ikke belønnes. Lad os tage Danmark tilbage - stem DF!🇩🇰,2351,164,5,10,10,https://www.tiktok.com/@malte.larsen0/video/7618222595892071702
malte.larsen0,Malte Larsen,Socialdemokratiet,Østjyllands Storkreds,kandidat,7617755095199010070,2026-03-16,"Luk Imam Ali moskéen, Irans forlængede arm i Danmark! Præstestyret har ingenting at skulle have gjort i vores land.",4183,236,4,22,12,https://www.tiktok.com/@malte.larsen0/video/7617755095199010070
malte.larsen0,Malte Larsen,Socialdemokratiet,Østjyllands Storkreds,kandidat,7617514172246445334,2026-03-15,"Indvandrere bør assimilere sig i det samfund, de flytter til. Det er ikke et urimeligt krav at stille.",9884,562,10,45,38,https://www.tiktok.com/@malte.larsen0/video/7617514172246445334
malte.larsen0,Malte Larsen,Socialdemokratiet,Østjyllands Storkreds,kandidat,7617446376347143446,2026-03-15,Samira Nawa har virkelig forstået sine vælgersegmenter! LGBT-plakater på Frederiksberg og Østerbro - og turban-plakater ved moskéerne på Nørrebro.,8120,504,10,98,43,https://www.tiktok.com/@malte.larsen0/video/7617446376347143446
malte.larsen0,Malte Larsen,Socialdemokratiet,Østjyllands Storkreds,kandidat,7617113485591317782,2026-03-14,"Befolkningsudskiftningen skal standses, før det er for sent! Det er ikke ekstremt - det er sund fornuft. Enig?👍🏻 ",1887,164,1,8,9,https://www.tiktok.com/@malte.larsen0/video/7617113485591317782
malte.larsen0,Malte Larsen,Socialdemokratiet,Østjyllands Storkreds,kandidat,7616727131271204119,2026-03-13,"Hussein siger “fuck Danmark”. Jeg siger til Hussein: hvis du hader Danmark, så rejs dog hjem! Enig?👍🏻",2941,238,11,13,14,https://www.tiktok.com/@malte.larsen0/video/7616727131271204119
malte.larsen0,Malte Larsen,Socialdemokratiet,Østjyllands Storkreds,kandidat,7616641587761663254,2026-03-13,Ellers tak!😬 Resten af Danmark må ikke ende som Nørrebro. Lad os kæmpe for at bevare et Danmark baseret på dansk kultur og værdier🇩🇰,40800,992,26,671,86,https://www.tiktok.com/@malte.larsen0/video/7616641587761663254
malte.larsen0,Malte Larsen,Socialdemokratiet,Østjyllands Storkreds,kandidat,7616389621110344982,2026-03-12,"🛑Luk det iranske terrorregimes ambassade i Danmark - og send deres diplomater hjem! De har ingenting at gøre i Danmark, hvor de spreder iransk indflydelse og overvåger eksiliranere, som er flygtet fra Iran for at leve i fred og frihed. Lad os sammen ",10400,430,10,27,30,https://www.tiktok.com/@malte.larsen0/video/7616389621110344982
malte.larsen0,Malte Larsen,Socialdemokratiet,Østjyllands Storkreds,kandidat,7616053357312068886,2026-03-11,"Nørrebro er bare et skønt sted! Kulturel berigelse over det hele. Stem ikke på DF, hvis du ønsker, at dit lokalområde skal se sådan her ud!",9937,693,26,140,43,https://www.tiktok.com/@malte.larsen0/video/7616053357312068886
malte.larsen0,Malte Larsen,Socialdemokratiet,Østjyllands Storkreds,kandidat,7615562843513031958,2026-03-10,"Hele 65% af irakere over 50 år lever på offentlig forsørgelse for dine og mine skattekroner, i stedet for at have et arbejde. Var der ikke på tide, at vi gjorde noget ved det?",7811,320,24,47,8,https://www.tiktok.com/@malte.larsen0/video/7615562843513031958
malte.larsen0,Malte Larsen,Socialdemokratiet,Østjyllands Storkreds,kandidat,7615259024195341590,2026-03-09,Kriminelle udlændinge skal rejse hjem!✈️,7843,400,6,20,20,https://www.tiktok.com/@malte.larsen0/video/7615259024195341590
malte.larsen0,Malte Larsen,Socialdemokratiet,Østjyllands Storkreds,kandidat,7615230494661184790,2026-03-09,"Nej, Rosa Lund - man er ikke “racist” eller “fremmedfjendsk”, fordi man ønsker en stram  udlændingepolitik.  Man er derimod en ansvarlig person, som insisterer på, at Danmark skal være et sikkert og trygt land baseret på danske værdier. Enig?👍🏻 ",3755,243,8,8,10,https://www.tiktok.com/@malte.larsen0/video/7615230494661184790
malte.larsen0,Malte Larsen,Socialdemokratiet,Østjyllands Storkreds,kandidat,7615005660895530243,2026-03-08,Make it make sense!,4568,277,14,13,12,https://www.tiktok.com/@malte.larsen0/video/7615005660895530243
malte.larsen0,Malte Larsen,Socialdemokratiet,Østjyllands Storkreds,kandidat,7614837820556889366,2026-03-08,"Rejs hjem, Mohamed Abdi Kahn! Du hører ikke til i Danmark med dine islamistiske holdninger. Til gengæld vil du passe godt ind i dit - eller dine forældres - hjemland.",15700,699,38,37,53,https://www.tiktok.com/@malte.larsen0/video/7614837820556889366
malte.larsen0,Malte Larsen,Socialdemokratiet,Østjyllands Storkreds,kandidat,7614615757997018391,2026-03-07,"Et vanvittigt forslag til udlændinge: lad være med at begå voldelige overfald, voldtægter eller drab, hvis du ikke ønsker at blive udvist fra Danmark.",12100,541,23,26,37,https://www.tiktok.com/@malte.larsen0/video/7614615757997018391
malte.larsen0,Malte Larsen,Socialdemokratiet,Østjyllands Storkreds,kandidat,7614452096884165910,2026-03-07,"Nu må det stoppe - vi skal ikke have islamisk fællesbøn i det offentlige rum!🛑 Og til de islamister, som ønsker at bo i et islamisk samfund præget af koranrecitationer og fællesbøn: rejs nu hjem! I hører ikke til i Danmark. Det vil være i alles inter",1764,192,10,20,15,https://www.tiktok.com/@malte.larsen0/video/7614452096884165910
malte.larsen0,Malte Larsen,Socialdemokratiet,Østjyllands Storkreds,kandidat,7614051254859320598,2026-03-06,"Islamister, rejs hjem! Hvis man hylder den morderiske ayatollah Khamenei, så hører I åbenlyst ikke til i Danmark. Det er nemlig udtryk for, at man har værdier og holdninger, som er fuldstændig uforenelige med vores samfund. For mig at se er det både ",2825,304,13,14,15,https://www.tiktok.com/@malte.larsen0/video/7614051254859320598
malte.larsen0,Malte Larsen,Socialdemokratiet,Østjyllands Storkreds,kandidat,7613740821757676822,2026-03-05,"Den pædofile voldtægtsforbryder, Ahmed Omar Mohamed, forbrød sig mod en 10-årig pige - men blev ikke udvist. Nu er han tiltalt for drabet på en 77-årig mand. Vi bliver nødt til at tage et opgør med Menneskerettighedsdomstolen, som forhindrer os i at ",3339,316,6,18,21,https://www.tiktok.com/@malte.larsen0/video/7613740821757676822
malte.larsen0,Malte Larsen,Socialdemokratiet,Østjyllands Storkreds,kandidat,7613361911115140374,2026-03-04,"Muhammad, rejs nu hjem til Mellemøsten! Du hører ikke til i Danmark - og vi vil ikke have dig her.",5680,391,22,6,21,https://www.tiktok.com/@malte.larsen0/video/7613361911115140374
malte.larsen0,Malte Larsen,Socialdemokratiet,Østjyllands Storkreds,kandidat,7613296998170807555,2026-03-04,Husk det nu🇩🇰😎,4031,186,19,19,8,https://www.tiktok.com/@malte.larsen0/video/7613296998170807555
malte.larsen0,Malte Larsen,Socialdemokratiet,Østjyllands Storkreds,kandidat,7613071017312783638,2026-03-03,"Jeg har en alvorlig bekymring, som jeg er nødt til at dele. En massiv flygtningekrise truer Danmark på grund af krig i Mellemøsten. Samtidig står vi midt i et folketingsvalg, hvor vi kan ende med en rød regering, der er afhængig af partier som Enheds",6731,594,29,81,27,https://www.tiktok.com/@malte.larsen0/video/7613071017312783638
malte.larsen0,Malte Larsen,Socialdemokratiet,Østjyllands Storkreds,kandidat,7612707376059256086,2026-03-02,"På Nørrebro hyldes Ali Khamenei - den nu afdøde islamiske diktator, som dræbte kvinder for ikke at bære tørklædet ordentligt - af hundredevis af mennesker med indvandrerbaggrund. Jeg synes ærlig talt, at disse terror-sympatisører skulle tage og rejse",1832,196,7,10,13,https://www.tiktok.com/@malte.larsen0/video/7612707376059256086
malte.larsen0,Malte Larsen,Socialdemokratiet,Østjyllands Storkreds,kandidat,7612288328787840278,2026-03-01,"94% af bandedømte har udlændingebaggrund. Var det ikke tide på tide, at vi sender dem hjem?",6274,486,67,17,32,https://www.tiktok.com/@malte.larsen0/video/7612288328787840278
malte.larsen0,Malte Larsen,Socialdemokratiet,Østjyllands Storkreds,kandidat,7611542163360632067,2026-02-27,"Muslimsk masseindvandring og gode vilkår for kvinder og seksuelle minoriteter går desværre ikke hånd i hånd. Det er åbenlyst. Venstrefløjen må droppe sig berøringsangst og melde sig ind i kampen for en stram og ansvarlig udlændingepolitik, hvis der s",3649,309,20,13,19,https://www.tiktok.com/@malte.larsen0/video/7611542163360632067
malte.larsen0,Malte Larsen,Socialdemokratiet,Østjyllands Storkreds,kandidat,7610693398743354646,2026-02-25,"En lærer dømt for seksuel grooming at et barn kan IGEN arbejde med børn efter bare 2 år. Det er helt forrykt. Folk som forbryder sig seksuelt mod børn, skal selvfølgelig ikke kunne arbejde med børn igen - vi skal ikke give “ekstra chancer” hvad det a",3562,237,16,12,21,https://www.tiktok.com/@malte.larsen0/video/7610693398743354646
malte.larsen0,Malte Larsen,Socialdemokratiet,Østjyllands Storkreds,kandidat,7610332059986447638,2026-02-24,"Kriminelle udlændinge skal udvise efter første dom! Når 64% af de palæstinensere, som kom til Danmark i 1992 har fået en dom for kriminalitet, har vi et kæmpe problem. Det er virkelige forbrydelser som grov vold, drab og voldtægt - som går ud over al",3737,318,23,18,24,https://www.tiktok.com/@malte.larsen0/video/7610332059986447638
malte.larsen0,Malte Larsen,Socialdemokratiet,Østjyllands Storkreds,kandidat,7609358404175269142,2026-02-21,"63% af libanesiske kvinder mellem 30 og 59 år lever på offentlig forsørgelse - for dine og mine skattekroner. Jeg synes det er på tide, at vi gør noget ved det. ",17300,549,86,44,31,https://www.tiktok.com/@malte.larsen0/video/7609358404175269142
malte.larsen0,Malte Larsen,Socialdemokratiet,Østjyllands Storkreds,kandidat,7608108575356931350,2026-02-18,"Når Socialdemokratiet er villige til at lyve overfor børn i et fiktivt skolevalg, kan vi nok godt forberede os på lidt af hvert til det kommende folketingsvalg… 🤔",2613,244,10,19,12,https://www.tiktok.com/@malte.larsen0/video/7608108575356931350
malte.larsen0,Malte Larsen,Socialdemokratiet,Østjyllands Storkreds,kandidat,7607913326546554114,2026-02-17,Mellemøstlige masseindvandring er den suverænt største trussel mod kvinders sikkerhed og tryghed. Så kære kvinder: hvis I ønsker at leve i tryghed og sikkerhed - og ønsker det samme for jeres (kommende) børn og børnebørn - så lad være med at stemme p,1275,185,7,8,10,https://www.tiktok.com/@malte.larsen0/video/7607913326546554114
malte.larsen0,Malte Larsen,Socialdemokratiet,Østjyllands Storkreds,kandidat,7607549059410234646,2026-02-16,"Roma-lejren hvor der sælges tyvekoster på Nørrebro St. er et godt eksempel på konsekvenserne af åbne grænser og fri indvandring. Lad os nu få styr på, hvem der kommer ind i vores land - og stille krav til at blive en del af samfundet! Enig?👍🏻",27400,728,47,48,48,https://www.tiktok.com/@malte.larsen0/video/7607549059410234646
malte.larsen0,Malte Larsen,Socialdemokratiet,Østjyllands Storkreds,kandidat,7607127352971250966,2026-02-15,LUK IMAM ALI-MOSKÉEN! Ayatollaherne skal ikke have mulighed for at udbrede deres religiøse og politiske indflydelse i Danmark. Enig?👍🏻 ,28200,1245,145,127,101,https://www.tiktok.com/@malte.larsen0/video/7607127352971250966
malte.larsen0,Malte Larsen,Socialdemokratiet,Østjyllands Storkreds,kandidat,7603459008371887382,2026-02-05,"Opfordring til intifada og massemord er åbenbart ikke lige så alvorligt, som det er at brænde en koran af - må man forstå🤔 Det er et eller andet galt, ikke?",1870,211,17,8,14,https://www.tiktok.com/@malte.larsen0/video/7603459008371887382
malte.larsen0,Malte Larsen,Socialdemokratiet,Østjyllands Storkreds,kandidat,7601823540836535574,2026-02-01,Kriminelle udlændinge skal udvises - konsekvent og efter første dom. 🇩🇰 #df,14600,1216,145,132,106,https://www.tiktok.com/@malte.larsen0/video/7601823540836535574
malte.larsen0,Malte Larsen,Socialdemokratiet,Østjyllands Storkreds,kandidat,7601229891132034327,2026-01-30,"Socialt bedrageri blandt ikke-vestlige indvandrere er et kæmpe problem. Mon ikke det var på tide, at vi fik gjort noget ved det? Jeg ønsker i hvert fald ikke at betale verdens højeste skat, for at andre kan gå derhjemmme og dandere den.",10900,606,73,26,51,https://www.tiktok.com/@malte.larsen0/video/7601229891132034327
malte.larsen0,Malte Larsen,Socialdemokratiet,Østjyllands Storkreds,kandidat,7596327688730709270,2026-01-17,Det her har jeg glædet mig utroligt meget til at dele! Danmark har fået sin første og eneste EU-kritiske tænketank - Tænketanken Heimdal - som jeg har fået æren af at stå i spidsen for.  I årevis har EU-debatten nemlig været domineret af ukritisk EU-,1831,169,8,1,10,https://www.tiktok.com/@malte.larsen0/video/7596327688730709270
malte.larsen0,Malte Larsen,Socialdemokratiet,Østjyllands Storkreds,kandidat,7595237148865907990,2026-01-14,Vores gæstfrihed skal ikke misbruges af kriminelle udlændinge. Respekter vores regler og værdier - eller rejs hjem. ,9234,796,68,79,58,https://www.tiktok.com/@malte.larsen0/video/7595237148865907990
malte.larsen0,Malte Larsen,Socialdemokratiet,Østjyllands Storkreds,kandidat,7593761463869639958,2026-01-10,Ahmed Omar Mohamed skulle være udvist efter første dom. Vi vil ikke have folk som ham i vores land! Enig?👍🏻 🇩🇰,1991,242,14,6,20,https://www.tiktok.com/@malte.larsen0/video/7593761463869639958
malte.larsen0,Malte Larsen,Socialdemokratiet,Østjyllands Storkreds,kandidat,7588156872205552918,2025-12-26,"Betonklodser foran julemarkederne i Danmark. Jeg synes ikke, at vi skal acceptere det som ny normaltilstand i Danmark. Enig?👍🏻🇩🇰",12800,833,76,38,45,https://www.tiktok.com/@malte.larsen0/video/7588156872205552918
malte.larsen0,Malte Larsen,Socialdemokratiet,Østjyllands Storkreds,kandidat,7584893734748294423,2025-12-17,"Kære feminister: hvis I vil tages seriøst, så drop berøringsangsten. Der er brug for det.",7176,491,17,21,32,https://www.tiktok.com/@malte.larsen0/video/7584893734748294423
malte.larsen0,Malte Larsen,Socialdemokratiet,Østjyllands Storkreds,kandidat,7583332777895005462,2025-12-13,Kriminelle udlændinge skal udvises efter første dom. Enig?🇩🇰,38500,2331,126,117,177,https://www.tiktok.com/@malte.larsen0/video/7583332777895005462
malte.larsen0,Malte Larsen,Socialdemokratiet,Østjyllands Storkreds,kandidat,7581913006716570902,2025-12-09,Uden masseindvandring ville vi have langt flere penge til velfærd og skattelettelser🇩🇰 #df ,10600,494,76,28,33,https://www.tiktok.com/@malte.larsen0/video/7581913006716570902
malte.larsen0,Malte Larsen,Socialdemokratiet,Østjyllands Storkreds,kandidat,7581155750479809814,2025-12-07,Nej til befolkningsudskiftningen🇩🇰,5929,380,32,15,44,https://www.tiktok.com/@malte.larsen0/video/7581155750479809814
