tiktok_handle,display_name,party_name,storkreds,account_type,video_id,upload_dato,beskrivelse,visninger,likes,kommentarer,shares,gemmer,video_url
venstresungdom,Venstres Ungdom,Venstre,Landsplan,ungdomsorganisation,7600399617238355222,2026-01-28,VU arbejder for skattelettelser til hårdtarbejdende danskere. Hør her VU's formand fortælle hvorfor 💙 #unge #politik #liberal #skat #debat ,5123,199,11,9,6,https://www.tiktok.com/@venstresungdom/video/7600399617238355222
venstresungdom,Venstres Ungdom,Venstre,Landsplan,ungdomsorganisation,7600667771638123798,2026-01-29,5 gode grunde til at stemme på Venstre til skolevalget 💙 #unge #politik #skolevalg #liberal #demokrati ,1933,54,3,1,3,https://www.tiktok.com/@venstresungdom/video/7600667771638123798
venstresungdom,Venstres Ungdom,Venstre,Landsplan,ungdomsorganisation,7619743964127644950,2026-03-21,"Vi skal fjerne forbuddet mod atomkraft, så vi kan udvikle fremtidens energiformer ⭐️! #unge #energi #klima #politik #dkpol ",979,39,0,1,1,https://www.tiktok.com/@venstresungdom/video/7619743964127644950
venstresungdom,Venstres Ungdom,Venstre,Landsplan,ungdomsorganisation,7618967340704681238,2026-03-19,"Hør Sebastian Støckler, kandidat for Venstre i Østjyllands storkreds, fortælle hvorfor det er vigtigt at have mere tillid til skolerne ⭐️ #unge #skole #uddannelse #politik #dkpol ",954,27,1,1,1,https://www.tiktok.com/@venstresungdom/video/7618967340704681238
venstresungdom,Venstres Ungdom,Venstre,Landsplan,ungdomsorganisation,7618163525810326786,2026-03-17,"Hør Josefine Paaske, kandidat på Sjælland, fortælle hvorfor vi skal afskaffe forbuddet mod atomkraft! ⭐️ #unge #politik #dkpol #frihed #klima ",1229,43,2,2,1,https://www.tiktok.com/@venstresungdom/video/7618163525810326786
venstresungdom,Venstres Ungdom,Venstre,Landsplan,ungdomsorganisation,7617761240718331158,2026-03-16,"Danmark har brug for en borgerlig, liberal regering igen! 💙 #unge #valg #politik #dkpol #frihed ",36800,1229,24,290,69,https://www.tiktok.com/@venstresungdom/video/7617761240718331158
venstresungdom,Venstres Ungdom,Venstre,Landsplan,ungdomsorganisation,7617466213286841623,2026-03-15,Staten skal ikke drive virksomhed!  #politik #unge #dkpol #liberal #vu ,930,34,2,1,0,https://www.tiktok.com/@venstresungdom/video/7617466213286841623
venstresungdom,Venstres Ungdom,Venstre,Landsplan,ungdomsorganisation,7617156508714945814,2026-03-14,"Emil, der stiller op i Aarhus, vil gøre det nemmere at komme ind på boligmarkedet! ⭐️ #unge #politik #dkpol #vu #aarhus ",938,28,2,0,1,https://www.tiktok.com/@venstresungdom/video/7617156508714945814
venstresungdom,Venstres Ungdom,Venstre,Landsplan,ungdomsorganisation,7616726108477623575,2026-03-13,Afskaf AM-bidraget! 💙 #unge #politik #dkpol #vu #frihed ,1125,42,3,2,0,https://www.tiktok.com/@venstresungdom/video/7616726108477623575
venstresungdom,Venstres Ungdom,Venstre,Landsplan,ungdomsorganisation,7616453725305179394,2026-03-12,"Hør vores formand fortælle om vores nye udspil, lavet i samarbejde med Konservativ Ungdom og Liberal Alliances Ungdom 💙 #unge #politik #vu #frihed #dkpol ",951,37,1,0,1,https://www.tiktok.com/@venstresungdom/video/7616453725305179394
venstresungdom,Venstres Ungdom,Venstre,Landsplan,ungdomsorganisation,7616373164272061718,2026-03-12,"I dag lancerer VU, KU og LAU et fælles folketingsvalgsudspil! 💙 Læs med i kommentaren ⭐️ #unge #politik #vu #frihed #dkpol  @Liberal Alliances Ungdom @Konservativ Ungdom ",872,46,2,0,1,https://www.tiktok.com/@venstresungdom/video/7616373164272061718
venstresungdom,Venstres Ungdom,Venstre,Landsplan,ungdomsorganisation,7616001065363852566,2026-03-11,Du er bedst til at bestemme over dit liv! 💙 #unge #politik #vu #frihed #dkpol ,1208,52,2,1,2,https://www.tiktok.com/@venstresungdom/video/7616001065363852566
venstresungdom,Venstres Ungdom,Venstre,Landsplan,ungdomsorganisation,7615546722407697686,2026-03-10,Hør her Jens' take på en ting der er træls i valgkampen #unge #politik #vu #frihed #dkpol ,1249,41,2,1,1,https://www.tiktok.com/@venstresungdom/video/7615546722407697686
venstresungdom,Venstres Ungdom,Venstre,Landsplan,ungdomsorganisation,7615283699839536406,2026-03-09,"Sænk registreringsafgiften! 🚘 Det er ualmindeligt dyrt at købe en bil i Danmark med en marginal afgift på 150%. Skatten er dermed dyrere end bilen. Det rammer særligt hårdt de steder i Danmark, hvor bilen er en nødvendighed. Lad os derfor gøre det bi",2166,92,4,5,2,https://www.tiktok.com/@venstresungdom/video/7615283699839536406
venstresungdom,Venstres Ungdom,Venstre,Landsplan,ungdomsorganisation,7614512782519635222,2026-03-07,"VU ønsker at hæve koblingsprocenten, for at styrke familiernes mulighed for at vælge den skole der er den rigtige for det enkelte barn 💙 #skole #frihed #vu #politik #debat ",600,41,2,1,1,https://www.tiktok.com/@venstresungdom/video/7614512782519635222
venstresungdom,Venstres Ungdom,Venstre,Landsplan,ungdomsorganisation,7614131495707413782,2026-03-06,"Venstres Ungdom flytter ind for Troels Lund i statsministeriet! ⭐️ I sidste uge udskrev Mette Frederiksen valg, og Alex Vanopslagh stod klar til at hjælpe hende med at flytte ud af statsministeriet. Derfor tager VU nu næste skridt og flytter ind for ",1315,39,7,1,1,https://www.tiktok.com/@venstresungdom/video/7614131495707413782
venstresungdom,Venstres Ungdom,Venstre,Landsplan,ungdomsorganisation,7613846506398846230,2026-03-05,Vi må ikke glemme udlændingepolitikken i valgkampen. #vu #politik #unge #dkpol #politiktok ,1039,36,4,0,1,https://www.tiktok.com/@venstresungdom/video/7613846506398846230
venstresungdom,Venstres Ungdom,Venstre,Landsplan,ungdomsorganisation,7613408965061283094,2026-03-04,"Mere frihed til skolerne, større investeringer og kortere skoledage? Hør Josefine, ung kandidat til folketinget for Venstre på Sjælland, fortælle hvad hun og VU vil gøre for en bedre skolegang! 💙 @Josefine Paaske  #unge #skole #sjælland #politik #dkp",1138,34,5,1,1,https://www.tiktok.com/@venstresungdom/video/7613408965061283094
venstresungdom,Venstres Ungdom,Venstre,Landsplan,ungdomsorganisation,7612972574934437142,2026-03-03,Formueskat vil gøre Danmark fattigere! ##vu##unge##politik##dkpol##liberal,553,39,2,1,1,https://www.tiktok.com/@venstresungdom/video/7612972574934437142
venstresungdom,Venstres Ungdom,Venstre,Landsplan,ungdomsorganisation,7612683774937074946,2026-03-02,Skynd dig at få sikret dig en billet til årets forårskursus! 🤩 #vu #unge #politik #dkpol #liberal ,1069,32,2,1,1,https://www.tiktok.com/@venstresungdom/video/7612683774937074946
venstresungdom,Venstres Ungdom,Venstre,Landsplan,ungdomsorganisation,7611923192902323479,2026-02-28,Vi skal skabe bedre muligheder for andelsvindmøller! ⭐️ #vu #politik #klima #liberal #unge ,1136,52,1,2,0,https://www.tiktok.com/@venstresungdom/video/7611923192902323479
venstresungdom,Venstres Ungdom,Venstre,Landsplan,ungdomsorganisation,7611614207473093910,2026-02-27,Socialdemokratiet har vist ikke helt fået finansieret deres skoleudspil - så hvor skal de sidste milliarder komme fra? Det vil vi gerne vide 🤔 #vu #valg #politik #unge #dkpol ,1488,63,8,1,1,https://www.tiktok.com/@venstresungdom/video/7611614207473093910
venstresungdom,Venstres Ungdom,Venstre,Landsplan,ungdomsorganisation,7611458522458393878,2026-02-27,"Danmark har brug for en borgerlig, liberal regering igen! #vu #valg #politik #unge #dkpol ",3059,131,4,44,9,https://www.tiktok.com/@venstresungdom/video/7611458522458393878
venstresungdom,Venstres Ungdom,Venstre,Landsplan,ungdomsorganisation,7611142909475196182,2026-02-26,"Der er udskrevet valg! I VU vil vi kæmpe for en borgerlig, liberal regering 💙 #valg #unge #politik #vu #dkpol ",1329,94,3,5,0,https://www.tiktok.com/@venstresungdom/video/7611142909475196182
venstresungdom,Venstres Ungdom,Venstre,Landsplan,ungdomsorganisation,7610078690940177686,2026-02-23,"Like, like, like! Så vi kan få Erik og Rune ud på en god løbetur! 🏃🏃‍♂️ #unge #vu #løb #challenge #politik ",1913,158,7,15,1,https://www.tiktok.com/@venstresungdom/video/7610078690940177686
venstresungdom,Venstres Ungdom,Venstre,Landsplan,ungdomsorganisation,7603779074904870166,2026-02-06,⚖️ Mere retfærdige strafferammer vedtages ⚖️  - Folketinget har vedtaget straffereformen (L83) I Venstres Ungdom har vi længe haft fokus på hårdere straffe for personfarlig kriminalitet Vi står på ofrenes side ❤️ – og i dag er et vigtigt skridt mod m,1724,74,2,4,4,https://www.tiktok.com/@venstresungdom/video/7603779074904870166
venstresungdom,Venstres Ungdom,Venstre,Landsplan,ungdomsorganisation,7603365640514096406,2026-02-05,Stort tillykke med fødselsdagen til Dronning Mary! 🇩🇰 Kongehuset er et unikt samlingspunkt for hele landet - men I VU mener vi samtidig at man bør bruge færre offentlige midler på kongehuset #politik #debat #vu #liberal #dkpol ,961,43,6,3,0,https://www.tiktok.com/@venstresungdom/video/7603365640514096406
venstresungdom,Venstres Ungdom,Venstre,Landsplan,ungdomsorganisation,7600760700843134230,2026-01-29,Stem Venstre til skolevalget! 💙 #vu #skolevalg #politik #debat #demokrati ,3454,129,6,4,1,https://www.tiktok.com/@venstresungdom/video/7600760700843134230
venstresungdom,Venstres Ungdom,Venstre,Landsplan,ungdomsorganisation,7600723366714166550,2026-01-29,"VU går ind for hårdere straffe for knivstikkeri, vi skal have mere tryghed tilbage i samfundet! 💙 #vu #tryghed #skolevalg #liberal #debat ",4110,130,4,1,4,https://www.tiktok.com/@venstresungdom/video/7600723366714166550
venstresungdom,Venstres Ungdom,Venstre,Landsplan,ungdomsorganisation,7600487269610310934,2026-01-28,"Alt for mange unge føler sig utrygge ved at gå alene når mørket falder på. Derfor vil VU hæve straffen for overfald med kniv, så vi kan få trygheden tilbage! 💙 #unge #politik #skolevalg  #liberal #tryghed ",2068,101,4,1,1,https://www.tiktok.com/@venstresungdom/video/7600487269610310934
venstresungdom,Venstres Ungdom,Venstre,Landsplan,ungdomsorganisation,7600290710776073494,2026-01-28,"VU vil afskaffe topskatten, fordi ingen skal betale over halvdelen af sin sidst-tjente krone i skat 💙 #unge #politik #skolevalg #demokrati #debat ",1626,54,2,3,1,https://www.tiktok.com/@venstresungdom/video/7600290710776073494
venstresungdom,Venstres Ungdom,Venstre,Landsplan,ungdomsorganisation,7600106517370637590,2026-01-27,Venstre og VU skaber konkrete resultater for dig 💙 Hop ind på https://borgerlige-resultater.dk/skolevalget/ og se hvad Venstre har gjort for dig ⭐️ #politik #skolevalg #resultat #unge #debat ,2162,63,4,8,4,https://www.tiktok.com/@venstresungdom/video/7600106517370637590
venstresungdom,Venstres Ungdom,Venstre,Landsplan,ungdomsorganisation,7600040371116150038,2026-01-27,Venstres Ungdom går til skolevalg på: 1. Bevaf mobiltelefoner i skolen 2. Hårdere straffe for knivstikkeri  3. Afskaf topskatten #vu #skolevalg #politik #debat #unge ,1494,47,8,3,3,https://www.tiktok.com/@venstresungdom/video/7600040371116150038
venstresungdom,Venstres Ungdom,Venstre,Landsplan,ungdomsorganisation,7599927368165199106,2026-01-27,VU siger nej til mobilforbud! 📱 Mobilen er et redskab - ikke noget der skal forbydes! 💙 #unge #vu #skolevalg #politik #debat ,1078,55,5,3,3,https://www.tiktok.com/@venstresungdom/video/7599927368165199106
venstresungdom,Venstres Ungdom,Venstre,Landsplan,ungdomsorganisation,7599732884404096259,2026-01-26,Venstre og VU skaber konkrete resultater for dig! 💙 #unge #vu #politik #skolevalg #dkpol ,1021,34,5,3,0,https://www.tiktok.com/@venstresungdom/video/7599732884404096259
venstresungdom,Venstres Ungdom,Venstre,Landsplan,ungdomsorganisation,7599547108001123606,2026-01-26,Hvad mener VU om skolevalgsmærkesagerne? 💙 Få her et overblik over vores holdninger til alle mærkesager på kun 1 minut ⭐️ #unge #vu #politik #skolevalg #dkpol ,14900,362,18,75,19,https://www.tiktok.com/@venstresungdom/video/7599547108001123606
venstresungdom,Venstres Ungdom,Venstre,Landsplan,ungdomsorganisation,7599351292133215510,2026-01-25,Venstre er klar til at se på forbuddet mht atomkraft  VU og Venstre skubber Danmark i en borgerlig retning 💙 #VU #unge #liberal #politik #atomkraft ,822,37,5,2,0,https://www.tiktok.com/@venstresungdom/video/7599351292133215510
venstresungdom,Venstres Ungdom,Venstre,Landsplan,ungdomsorganisation,7599238131451235606,2026-01-25,Vi glæder os til debatterne for alvor begynder i morgen! 💙 #unge #VU #politik #københavn #trend ,3521,168,5,13,4,https://www.tiktok.com/@venstresungdom/video/7599238131451235606
venstresungdom,Venstres Ungdom,Venstre,Landsplan,ungdomsorganisation,7598966820065987843,2026-01-24,En af VU's mærkesager til skolevalget er at knivstikkeri skal straffes hårdere ⚖️ Hør hvorfor her ⭐️ #unge #politik #skolevalg #VU #justice ,3002,87,6,9,4,https://www.tiktok.com/@venstresungdom/video/7598966820065987843
venstresungdom,Venstres Ungdom,Venstre,Landsplan,ungdomsorganisation,7598881262517980439,2026-01-24,Venstre har styrket kvinders ret til at bestemme over egen krop! 💙 Venstre og VU skaber konkrete resultater for dig! ⭐️ #unge #politik #abort #ret #Venstre ,1370,44,3,0,1,https://www.tiktok.com/@venstresungdom/video/7598881262517980439
venstresungdom,Venstres Ungdom,Venstre,Landsplan,ungdomsorganisation,7598563258416516374,2026-01-23,VU's mærkesager til skolevalget! 💙 #unge #politik #debat #skolevalg #vu ,1650,79,11,3,0,https://www.tiktok.com/@venstresungdom/video/7598563258416516374
venstresungdom,Venstres Ungdom,Venstre,Landsplan,ungdomsorganisation,7598438159340424470,2026-01-23,VU skaber resultater for dig! ⭐️ VU har kæmpet for at 17-årige nu kan køre bil uden ledsager - det synes vi er ret fedt! 💙 #unge #vu #politik #transport #skole ,1211,66,2,4,2,https://www.tiktok.com/@venstresungdom/video/7598438159340424470
venstresungdom,Venstres Ungdom,Venstre,Landsplan,ungdomsorganisation,7598207083728620822,2026-01-22,Kørekort til 17-årige! 💙  VU og Venstre skaber resultater for dig! #unge #transport #VU #Venstre  #politik ,1532,61,6,1,1,https://www.tiktok.com/@venstresungdom/video/7598207083728620822
venstresungdom,Venstres Ungdom,Venstre,Landsplan,ungdomsorganisation,7597832513066700054,2026-01-21,VU og Venstre har afskaffet AM-bidraget for unge under 18 🎉 VU og Venstre skaber resultater for unge! 💙 #unge #vu #politik #debat #liberal ,1520,76,5,10,3,https://www.tiktok.com/@venstresungdom/video/7597832513066700054
venstresungdom,Venstres Ungdom,Venstre,Landsplan,ungdomsorganisation,7597070090403679510,2026-01-19,Venstre skaber konkrete resultater der gør unges hverdag bedre! 💙 #vu #unge #skole #politik #debat ,1650,77,10,3,4,https://www.tiktok.com/@venstresungdom/video/7597070090403679510
venstresungdom,Venstres Ungdom,Venstre,Landsplan,ungdomsorganisation,7596702356897647894,2026-01-18,"Har du nogensinde overvejet, hvordan politik egentlig påvirker din hverdag? ⭐️ Se med her 💙 #vu #unge #politik #hverdag #skole ",787,49,4,2,1,https://www.tiktok.com/@venstresungdom/video/7596702356897647894
venstresungdom,Venstres Ungdom,Venstre,Landsplan,ungdomsorganisation,7596385187450129686,2026-01-17,VU har været med til at sikre frit gymnasievalg! 💙 #unge #vu #skole #gym #politik ,925,68,10,2,0,https://www.tiktok.com/@venstresungdom/video/7596385187450129686
venstresungdom,Venstres Ungdom,Venstre,Landsplan,ungdomsorganisation,7595939902504586499,2026-01-16,Har du et fritidsjob - og er du under 18? Så har VU sørget for at du ikke skal betale AM-bidrag og dermed selv kan beholde din løn fra dit fritidsjob ⭐️ #unge #vu #arbejde #politik #skole ,1325,59,8,9,2,https://www.tiktok.com/@venstresungdom/video/7595939902504586499
venstresungdom,Venstres Ungdom,Venstre,Landsplan,ungdomsorganisation,7594125242310642966,2026-01-11,"Skolevalget er udskrevet, vi glæder os! 💙 #unge #vu #skole #politik #debat ",1227,50,2,1,1,https://www.tiktok.com/@venstresungdom/video/7594125242310642966
venstresungdom,Venstres Ungdom,Venstre,Landsplan,ungdomsorganisation,7593684727719120150,2026-01-10,Vi glæder os! 💙 #skole #unge #vu #politik #debat ,893,54,4,1,2,https://www.tiktok.com/@venstresungdom/video/7593684727719120150
venstresungdom,Venstres Ungdom,Venstre,Landsplan,ungdomsorganisation,7593376761866521879,2026-01-09,"Kom med d. 17. januar når vi mødes i Aarhus, til en dag med fokus på at blive skarp til debat! 💙 Vi glæder os! #unge #vu #debat #aarhus #politik ",1767,54,8,15,3,https://www.tiktok.com/@venstresungdom/video/7593376761866521879
venstresungdom,Venstres Ungdom,Venstre,Landsplan,ungdomsorganisation,7591515722640084246,2026-01-04,Kom til skolevalgsbootcamp med VU d. 17. januar i Aarhus - billetterne er sat til salg! 🎉 Vi glæder os til at se dig! ⭐️ #vu #unge #politik #debat #aarhus ,1144,43,5,5,0,https://www.tiktok.com/@venstresungdom/video/7591515722640084246
venstresungdom,Venstres Ungdom,Venstre,Landsplan,ungdomsorganisation,7590810697303346454,2026-01-02,De 4 fedeste ting ved VU💙🫶🏻 #venstresungdom #vu #fyp #dkpol ,715,35,1,3,0,https://www.tiktok.com/@venstresungdom/video/7590810697303346454
venstresungdom,Venstres Ungdom,Venstre,Landsplan,ungdomsorganisation,7590086187524640022,2025-12-31,Bevar privat fyrværkeri! 🎆  #vu #unge #nytår #politik #fri ,1240,30,1,2,3,https://www.tiktok.com/@venstresungdom/video/7590086187524640022
venstresungdom,Venstres Ungdom,Venstre,Landsplan,ungdomsorganisation,7589267369193671958,2025-12-29,"Ingen skal betale over halvdelen af sin sidst-tjente krone i skat, afskaf topskatten! 💙 #vu #unge #skat #politik #danmark ",1418,56,6,4,0,https://www.tiktok.com/@venstresungdom/video/7589267369193671958
venstresungdom,Venstres Ungdom,Venstre,Landsplan,ungdomsorganisation,7588959977939668246,2025-12-28,Velkommen til vores mange nye medlemmer 💙⭐️ #vu #unge #politik #trend #viral ,1303,72,8,14,1,https://www.tiktok.com/@venstresungdom/video/7588959977939668246
venstresungdom,Venstres Ungdom,Venstre,Landsplan,ungdomsorganisation,7588922046109781270,2025-12-28,Vi vil gerne have fjernet fadølsafgiften! 🍻 Hør her hvorfor 💙 #vu #unge #fyp #politik #øl ,972,57,13,3,3,https://www.tiktok.com/@venstresungdom/video/7588922046109781270
venstresungdom,Venstres Ungdom,Venstre,Landsplan,ungdomsorganisation,7588510395699137814,2025-12-27,Fik du heller ikk den julegave du havde ønsket dig? Giv dig selv et medlemsskab af VU ⭐️ #unge #vu #politik #jul #gave ,1418,61,10,22,2,https://www.tiktok.com/@venstresungdom/video/7588510395699137814
venstresungdom,Venstres Ungdom,Venstre,Landsplan,ungdomsorganisation,7588136312516054274,2025-12-26,Lukkeloven er et levn fra fortiden 🎄 Venstres Ungdom kæmper for mere frihed og mindre unødvendig regulering 💙 #unge #vu #politik #jul #christmas ,2587,75,10,2,3,https://www.tiktok.com/@venstresungdom/video/7588136312516054274
venstresungdom,Venstres Ungdom,Venstre,Landsplan,ungdomsorganisation,7584457775254637846,2025-12-16,Vi glæder os til skolevalg! #unge #vu #trend #valg #skole ,1452,95,7,2,0,https://www.tiktok.com/@venstresungdom/video/7584457775254637846
venstresungdom,Venstres Ungdom,Venstre,Landsplan,ungdomsorganisation,7581914796409261334,2025-12-09,Venstre rydder op i unødvendige love - tak til transportminister Thomas Danielsen! #unge #vu #transport #politik #dkpol  @Transportministeren🛻 ,849,43,4,3,0,https://www.tiktok.com/@venstresungdom/video/7581914796409261334
venstresungdom,Venstres Ungdom,Venstre,Landsplan,ungdomsorganisation,7580761759456234754,2025-12-06,Hvad ønsker vi os til jul? Se med her 🎄 #VU #unge #jul #christmas #politik ,1631,85,6,17,6,https://www.tiktok.com/@venstresungdom/video/7580761759456234754
venstresungdom,Venstres Ungdom,Venstre,Landsplan,ungdomsorganisation,7580273845853097238,2025-12-05,"Hvordan styrker vi Danmark og EU til fremtidens udfordringer, se med her ⭐️ #unge #vu #politik #eu  #europe  @amandaheitmann ",720,34,7,6,3,https://www.tiktok.com/@venstresungdom/video/7580273845853097238
venstresungdom,Venstres Ungdom,Venstre,Landsplan,ungdomsorganisation,7577795716723215639,2025-11-28,Nej til kvoter i bestyrelser 💙 #unge #vu #Politik #ligestilling #dkpol ,1363,34,5,3,1,https://www.tiktok.com/@venstresungdom/video/7577795716723215639
venstresungdom,Venstres Ungdom,Venstre,Landsplan,ungdomsorganisation,7577429522308517142,2025-11-27,Nej - selvfølgelig skal der ikke være aldersgrænse på TikTok 💙 #TikTok #unge #vu #Politik #dkpol ,1849,76,7,2,4,https://www.tiktok.com/@venstresungdom/video/7577429522308517142
venstresungdom,Venstres Ungdom,Venstre,Landsplan,ungdomsorganisation,7576691324343061782,2025-11-25,"Kom med til VU's EU-konference på lørdag, d. 29 november 🇪🇺. Vi glæder os til at se jer! #politik #unge #vu #eu #Europa ",1120,47,3,0,0,https://www.tiktok.com/@venstresungdom/video/7576691324343061782
venstresungdom,Venstres Ungdom,Venstre,Landsplan,ungdomsorganisation,7573941341097348374,2025-11-18,Så er det valgdag! Vi anbefaler en personlig stemme på din lokale VU-kandidat ⭐️. God valgdag! #valg #unge #stem #politik #dk ,1115,28,2,0,0,https://www.tiktok.com/@venstresungdom/video/7573941341097348374
venstresungdom,Venstres Ungdom,Venstre,Landsplan,ungdomsorganisation,7573782847631166742,2025-11-17,"1 måneds valgkamp med VU i billeder. Så er det i morgen vi skal stemme til kommunal- og regionsrådsvalg, vi anbefaler en stemme på din lokale VU-kandidat 💙 #unge #valg #vu #politik #dk ",1107,41,3,1,0,https://www.tiktok.com/@venstresungdom/video/7573782847631166742
venstresungdom,Venstres Ungdom,Venstre,Landsplan,ungdomsorganisation,7573344600266427670,2025-11-16,"Mød Mathias, VU's spidskandidat i Aalborg ⭐️ @Mathias Hasager  #Aalborg #unge #vu #kv #politik ",1077,24,7,2,0,https://www.tiktok.com/@venstresungdom/video/7573344600266427670
venstresungdom,Venstres Ungdom,Venstre,Landsplan,ungdomsorganisation,7572656084876381462,2025-11-14,"Mød Julie, VU's spidskandidat i Odense ⭐️ #Odense #unge #vu #kv #politik",713,33,3,2,0,https://www.tiktok.com/@venstresungdom/video/7572656084876381462
venstresungdom,Venstres Ungdom,Venstre,Landsplan,ungdomsorganisation,7571906493037972758,2025-11-12,"Mød Nicklas, VU's spidskandidat i København ⭐️ #København #unge #vu #kv #politik ",497,25,1,1,0,https://www.tiktok.com/@venstresungdom/video/7571906493037972758
venstresungdom,Venstres Ungdom,Venstre,Landsplan,ungdomsorganisation,7571518628646931734,2025-11-11,En kampagnedag med VU med kun 1 uge til valget 💙 #unge #vu #kv #valg #politik ,1072,31,0,0,1,https://www.tiktok.com/@venstresungdom/video/7571518628646931734
venstresungdom,Venstres Ungdom,Venstre,Landsplan,ungdomsorganisation,7571384873189920022,2025-11-11,"En dag med VU's Landsstyrelsesnæstformand, Julie, under valgkampen ☀️💙 #VU #valg #vu #unge #kv ",1054,27,3,3,0,https://www.tiktok.com/@venstresungdom/video/7571384873189920022
venstresungdom,Venstres Ungdom,Venstre,Landsplan,ungdomsorganisation,7570682825616198934,2025-11-09,"Mød Laurits, VU's spidskandidat i Aarhus ⭐️ #Aarhus #VU #unge #politik #valg ",1101,25,4,0,0,https://www.tiktok.com/@venstresungdom/video/7570682825616198934
venstresungdom,Venstres Ungdom,Venstre,Landsplan,ungdomsorganisation,7568525917346204950,2025-11-03,Mød VU's spidskandidater til regionsrådene - og hør lidt om hvorfor de har valgt at stille op 💙 #unge #rv #politik #vu #valg ,617,38,3,3,1,https://www.tiktok.com/@venstresungdom/video/7568525917346204950
venstresungdom,Venstres Ungdom,Venstre,Landsplan,ungdomsorganisation,7568078916813114627,2025-11-02,Synes du også vi skal have flere unge ind i byråd og regionsråd? - hør med her 💙 #unge #kv #valg #politik #dk ,1381,70,3,3,0,https://www.tiktok.com/@venstresungdom/video/7568078916813114627
venstresungdom,Venstres Ungdom,Venstre,Landsplan,ungdomsorganisation,7566617914745310486,2025-10-29,Tag med VU til plakatdag ⭐️💙 #vu #unge #danmark #politik #lørdag ,923,59,2,4,1,https://www.tiktok.com/@venstresungdom/video/7566617914745310486
venstresungdom,Venstres Ungdom,Venstre,Landsplan,ungdomsorganisation,7565205273523129622,2025-10-25,Plakatdag med VU 💙 #valg #dkpol #vu #politik #unge ,1395,63,3,2,0,https://www.tiktok.com/@venstresungdom/video/7565205273523129622
venstresungdom,Venstres Ungdom,Venstre,Landsplan,ungdomsorganisation,7564770434869153046,2025-10-24,VU er klar til at hænge plakater op i morgen - vi ses derude! ⭐️ #vu #politik #unge #klar #lørdag ,1726,73,6,6,1,https://www.tiktok.com/@venstresungdom/video/7564770434869153046
venstresungdom,Venstres Ungdom,Venstre,Landsplan,ungdomsorganisation,7563685395502746902,2025-10-21,Tag med Venstres Ungdom til Kulturnat 💙 #politik #unge #rater #event #VU ,2171,85,6,5,3,https://www.tiktok.com/@venstresungdom/video/7563685395502746902
venstresungdom,Venstres Ungdom,Venstre,Landsplan,ungdomsorganisation,7561487780614851862,2025-10-15,Tag med til VU's EU-konference d. 29. november! 💙 #VU #EU #Politik #unge #dkpol ,791,35,3,2,1,https://www.tiktok.com/@venstresungdom/video/7561487780614851862
venstresungdom,Venstres Ungdom,Venstre,Landsplan,ungdomsorganisation,7559195856117845270,2025-10-09,VU lancerer nyt forsyningsudspil - se hvordan Venstre tager imod det! 💙 #VU #Venstre #klima #unge #politik  ,1537,55,8,8,1,https://www.tiktok.com/@venstresungdom/video/7559195856117845270
venstresungdom,Venstres Ungdom,Venstre,Landsplan,ungdomsorganisation,7556997439337549078,2025-10-03,Vi giver telefonen videre 📞💙 #trend #VU #politik #unge #givertelefonenvidere ,1063,56,1,8,0,https://www.tiktok.com/@venstresungdom/video/7556997439337549078
venstresungdom,Venstres Ungdom,Venstre,Landsplan,ungdomsorganisation,7555866930511383830,2025-09-30,Borgernes retssikkerhed i mødet med staten skal styrkes - derfor bakker VU op om Venstres melding! #politik #VU #Venstre #retssikkerhed #dkpol ,787,43,2,5,0,https://www.tiktok.com/@venstresungdom/video/7555866930511383830
